Questions,label1,label2,uri1,uri2,label1len,label2len,uri1Label,uri2Label
Does Saneh Lungkeaw play for the Thailand's national team,national team,,http://dbpedia.org/property/nationalteam,,2,0,nationalteam,
Who all have been presenters on shows by the NBC,,presenter,http://dbpedia.org/ontology/channel,http://dbpedia.org/property/presenter,0,1,channel,presenter
What tv shows were born out of a collaboration of playtone and dreamworks,collaboration,collaboration,http://dbpedia.org/ontology/company,http://dbpedia.org/ontology/company,1,1,company,company
Who all have written songs that were then recorded in the Criteria Studios,recorded in,written,http://dbpedia.org/ontology/recordedIn,http://dbpedia.org/property/writer,2,1,recordedIn,writer
What are all the religions that have been followed by the Sir Lankan attorneys,attorneys,religion,http://dbpedia.org/ontology/profession,http://dbpedia.org/ontology/religion,1,1,profession,religion
What are the central characters in spy kids series,series,,http://dbpedia.org/ontology/series,,1,0,series,
Through how many labels has Katy B released her singles,singles,label,http://dbpedia.org/ontology/writer,http://dbpedia.org/ontology/recordLabel,1,1,writer,recordLabel
How many people have written for Gangan Comics,written,written,http://dbpedia.org/property/magazine,http://dbpedia.org/property/author,1,1,magazine,author
Is William H Blanchard buried in Colorado,,,http://dbpedia.org/property/placeofburial,,0,0,placeofburial,
Name the common institute of Robert hall and Erica Frank,institute,institute,http://dbpedia.org/ontology/institution,http://dbpedia.org/ontology/institution,1,1,institution,institution
How many other important work has been done by the writers of Sarah Jane Adventures,work,work,http://dbpedia.org/property/notableworks,http://dbpedia.org/ontology/notableWork,1,1,notableworks,notableWork
Is GIMP written in GTK+,written,,http://dbpedia.org/property/programmingLanguage,,1,0,programmingLanguage,
Whose families are Buccinoidea and Buccinidae,families,families,http://dbpedia.org/ontology/family,http://dbpedia.org/ontology/family,1,1,family,family
In how many places are the tombs of people who died in Connecticut Colony,places,tomb,http://dbpedia.org/property/placeOfDeath,http://dbpedia.org/ontology/restingPlace,1,1,placeOfDeath,restingPlace
How many shows are aired on Comedy Central,aired,,http://dbpedia.org/property/network,,1,0,network,
Where does the river flow into which begins in Lebrsnik,begins,river,http://dbpedia.org/ontology/sourcePlace,http://dbpedia.org/ontology/riverMouth,1,1,sourcePlace,riverMouth
What is the colour of Xocolatlite,colour,,http://dbpedia.org/ontology/colour,,1,0,colour,
How many movies are directed by the spouse of Dolores del Ro,spouse,directed,http://dbpedia.org/property/partner,http://dbpedia.org/property/director,1,1,partner,director
Name the loocation of Lekh Castle which is also the location of SamurAbsheron channel,location,channel,http://dbpedia.org/ontology/location,http://dbpedia.org/ontology/sourceCountry,1,1,location,sourceCountry
what mountains are in sierra nevada,mountains,,http://dbpedia.org/ontology/mountainRange,,1,0,mountainRange,
Was True Grit a novel of the western genre,genre,,http://dbpedia.org/ontology/literaryGenre,,1,0,literaryGenre,
Name the wine regions of Baco noir,wine region,,http://dbpedia.org/ontology/wineRegion,,2,0,wineRegion,
Name the president of Wyche Fowler,president,,http://dbpedia.org/ontology/president,,1,0,president,
Name the parts of the settlements which has New Braunfels as one of the parts,part,part,http://dbpedia.org/ontology/part,http://dbpedia.org/ontology/part,1,1,part,part
How many party are there of the office holders whose one of the party is Janata Dal,party,party,http://dbpedia.org/ontology/otherParty,http://dbpedia.org/ontology/otherParty,1,1,otherParty,otherParty
name the home stadium of FC Spartak Moscow season 2011-12,home stadium,,http://dbpedia.org/ontology/homeStadium,,2,0,homeStadium,
How many causes of death have been associated with American citizens,citizens,death,http://dbpedia.org/property/citizenship,http://dbpedia.org/ontology/deathCause,1,1,citizenship,deathCause
Is Bluebird the grandsire of Miss Potential,grandsire,,http://dbpedia.org/ontology/grandsire,,1,0,grandsire,
Is semnani one of the languages spoken in Iran,languages,,http://dbpedia.org/property/languages,,1,0,languages,
Who made the singles on the famous album Aida,album,Aida,http://dbpedia.org/ontology/album,http://dbpedia.org/ontology/musicalArtist,1,1,album,musicalArtist
Who is the associate of Thomas Bryan Martin,associate,,http://dbpedia.org/ontology/associate,,1,0,associate,
What sport played in Polytechnic uni of San Juan has also made advocate nasiruddin famous,famous,sport,http://dbpedia.org/ontology/knownFor,http://dbpedia.org/ontology/sport,1,1,knownFor,sport
List the academic discipline of the journals whose one of the discipline is neuro imaging,academic discipline,academic discipline,http://dbpedia.org/ontology/academicDiscipline,http://dbpedia.org/ontology/academicDiscipline,2,2,academicDiscipline,academicDiscipline
Which countries were led by Pietro Parolin,led,,http://dbpedia.org/ontology/leader,,1,0,leader,
was the first national bank and trust building architectured by Chicago,architecture,,http://dbpedia.org/ontology/architecturalStyle,,1,0,architecturalStyle,
"Where does the road starting from Madison, Wisconsin end",end,starting,http://dbpedia.org/ontology/routeEnd,http://dbpedia.org/ontology/routeStart,1,1,routeEnd,routeStart
What are the movies written by Nick Castle,written by,,http://dbpedia.org/ontology/writer,,2,0,writer,
How many bands began in Birmingham,in,,http://dbpedia.org/property/origin,,1,0,origin,
How many athletic associations are there in all of the private universities,es,athletic,http://dbpedia.org/property/type,http://dbpedia.org/property/athletics,1,1,type,athletics
Name the Chris Marve's school,school,,http://dbpedia.org/ontology/school,,1,0,school,
"In how many areas do the networks broadcast, which also broadcasts in North Carolina",broadcasts,area,http://dbpedia.org/ontology/broadcastArea,http://dbpedia.org/property/area,1,1,broadcastArea,area
Name the movie whose director of photography is Gregg Toland and Bernard Herrmann was the music composer,photography,music composer,http://dbpedia.org/ontology/cinematography,http://dbpedia.org/ontology/musicComposer,1,2,cinematography,musicComposer
What are the awrds won by Laemmle Theatres,won,,http://dbpedia.org/ontology/service,,1,0,service,
"People of which religion have been the members of parliament, and are from the Kalutara Electoral district",members,religion,http://dbpedia.org/ontology/region,http://dbpedia.org/ontology/religion,1,1,region,religion
Give me a count of movies distributed by Warner Bros,distributed by,,http://dbpedia.org/property/distributor,,2,0,distributor,
From how many different cities have people gone to the Illinois Fighting Illini men's basketball,basketball,,http://dbpedia.org/ontology/college,http://dbpedia.org/property/placeOfBirth,1,0,college,placeOfBirth
Did nokia 215 has the series 30+ OS,OS,,http://dbpedia.org/property/os,,1,0,os,
Sampson Cudjoe plays for the Ghana national team,national team,,http://dbpedia.org/property/nationalteam,,2,0,nationalteam,
How many owners owned the clubs participating in the Premier leagues of '14,leagues,owners,http://dbpedia.org/ontology/season,http://dbpedia.org/property/owner,1,1,season,owner
Which writer of A literary Nightmare also extended the work of The Apple tree,work,writer,http://dbpedia.org/ontology/basedOn,http://dbpedia.org/ontology/author,1,1,basedOn,author
"How many licensee are there, of the radio stations whose area is Nashville, Tennessee",area,licensee,http://dbpedia.org/property/area,http://dbpedia.org/property/licensee,1,1,area,licensee
How many people are in the band with Juelz Santana,people,band,http://dbpedia.org/property/currentMembers,http://dbpedia.org/ontology/bandMember,1,1,currentMembers,bandMember
In which country is the Duong river,country,,http://dbpedia.org/ontology/sourceCountry,,1,0,sourceCountry,
Was Elton John a chairman of a Watford FC Season,chairman,,http://dbpedia.org/ontology/chairman,,1,0,chairman,
List the common official language of the ladonia and Empire of Atlantium,official language,official language,http://dbpedia.org/ontology/officialLanguage,http://dbpedia.org/ontology/officialLanguage,2,2,officialLanguage,officialLanguage
Does the stylistic origins of Plena lie in the Caribbean,stylistic origins,,http://dbpedia.org/property/stylisticOrigins,,2,0,stylisticOrigins,
"Whose album is Haiti, I am sorry",album,,http://dbpedia.org/ontology/album,,1,0,album,
"In which other places are there companies which are in Ontario, too",companies,companies,http://dbpedia.org/ontology/locationCity,http://dbpedia.org/property/locations,1,1,locationCity,locations
Where did the music genre of Harry and the Potters originate,music genre,originate,http://dbpedia.org/ontology/genre,http://dbpedia.org/ontology/stylisticOrigin,2,1,genre,stylisticOrigin
Who directed The Haunted House,directed,,http://dbpedia.org/ontology/director,,1,0,director,
For how many movies are there whose musicians home town is in Volos,home town,music,http://dbpedia.org/ontology/hometown,http://dbpedia.org/property/music,2,1,hometown,music
What is the religion of the member of parliament who is a relative of Sarathchandra Rajakaruna,relative,religion,http://dbpedia.org/ontology/relation,http://dbpedia.org/ontology/religion,1,1,relation,religion
what awards have been given to A. Peter Dewey,awards,,http://dbpedia.org/ontology/award,,1,0,award,
From how many different places did the weapons used in the American Indian wars originate,used,origin,http://dbpedia.org/ontology/usedInWar,http://dbpedia.org/property/origin,1,1,usedInWar,origin
"From where does the river start, which flows into the Conowingo dam",river,flows,http://dbpedia.org/ontology/riverMouth,http://dbpedia.org/ontology/source,1,1,riverMouth,source
What is the total number of politicians whose predecessor's deputy is Jenny Macklin,deputy,predecessor,http://dbpedia.org/property/deputy,http://dbpedia.org/property/predecessor,1,1,deputy,predecessor
Count all the shows whose music composers are in Oysterhead.,music,composers,http://dbpedia.org/ontology/associatedMusicalArtist,http://dbpedia.org/property/themeMusicComposer,1,1,associatedMusicalArtist,themeMusicComposer
In which timezone does Khok Kwang lie,timezone,,http://dbpedia.org/ontology/timeZone,,1,0,timeZone,
How many bands have members currently playing the Fender Stratocaster,playing,members,http://dbpedia.org/property/notableInstruments,http://dbpedia.org/property/currentMembers,1,1,notableInstruments,currentMembers
Which country has leaders  Karu Jayasuriya and Ranil Wickremesinghe,leader,leader,http://dbpedia.org/ontology/leader,http://dbpedia.org/ontology/leader,1,1,leader,leader
List the software which uses Microsoft Windows as their operating system,operating system,,http://dbpedia.org/ontology/operatingSystem,,2,0,operatingSystem,
How many religions have the relatives of waxiangs followed,relatives,religion,http://dbpedia.org/property/related,http://dbpedia.org/ontology/religion,1,1,related,religion
What kind of games does Blizzard games develop,develop,Blizzard,http://dbpedia.org/ontology/developer,http://dbpedia.org/ontology/genre,1,1,developer,genre
Which expertise of the Menetries's warbler is the  nationality of the Jeyhun Abiyev,expertise,nationality,http://dbpedia.org/ontology/binomialAuthority,http://dbpedia.org/ontology/nationality,1,1,binomialAuthority,nationality
In how many places can I find wine made of Vitis vinifera grapes,grapes,wine,http://dbpedia.org/ontology/species,http://dbpedia.org/ontology/wineRegion,1,1,species,wineRegion
List all the bands which have members of the band Guy in them,members,band,http://dbpedia.org/ontology/bandMember,http://dbpedia.org/ontology/associatedBand,1,1,bandMember,associatedBand
Name a fictional character whose relative is Uncle Henry and species is Human,relative,species,http://dbpedia.org/ontology/relative,http://dbpedia.org/ontology/species,1,1,relative,species
What is the draft team of Dale Mitchell (ice hockey),draft team,,http://dbpedia.org/ontology/draftTeam,,2,0,draftTeam,
Was the skeleton dance animated by Walt Disney,animated,,http://dbpedia.org/ontology/animator,,1,0,animator,
To which educational institutions did Lesli Sanchez go for her studies,education,,http://dbpedia.org/ontology/education,,1,0,education,
Who was the coach of 1972 Oakland Raiders season,coach,,http://dbpedia.org/ontology/coach,,1,0,coach,
How many developers make softwares for Unix like operating systems,operating system,developer,http://dbpedia.org/property/operatingSystem,http://dbpedia.org/ontology/developer,2,1,operatingSystem,developer
What is the religion of the ones in the Kampuchean Union of Salvation,,religion,http://dbpedia.org/ontology/militaryBranch,http://dbpedia.org/ontology/religion,0,1,militaryBranch,religion
"List the employments of people who died in Tampa, Florida.",died in,employment,http://dbpedia.org/ontology/deathPlace,http://dbpedia.org/ontology/occupation,2,1,deathPlace,occupation
List the destination of Novair International Airways,destination,,http://dbpedia.org/ontology/destination,,1,0,destination,
How many states are in the Mediterranean Basketball Association,state,,http://dbpedia.org/ontology/country,,1,0,country,
Name the television show whose subsequent work is Frasier and opening theme is Where Everybody Knows Your Name,subsequent work,opening theme,http://dbpedia.org/ontology/subsequentWork,http://dbpedia.org/ontology/openingTheme,2,2,subsequentWork,openingTheme
Where is the football team located in which Josh Bell did his debut,debut team,debut,http://dbpedia.org/ontology/debutTeam,http://dbpedia.org/ontology/locationCity,2,1,debutTeam,locationCity
Who was engaged in wars of Fort Gadsden and Fort Barrancas,war,war,http://dbpedia.org/ontology/battle,http://dbpedia.org/ontology/battle,1,1,battle,battle
What are some awards given to people who were born in sweden,born in,awards,http://dbpedia.org/ontology/birthPlace,http://dbpedia.org/property/awards,2,1,birthPlace,awards
Is Hard Candy Fitness one of the divisions of Moscow,divisions,,http://dbpedia.org/property/divisions,,1,0,divisions,
Is WP 8.1 the OS on Lumia 830,OS,,http://dbpedia.org/property/os,,1,0,os,
Do the polet airlines fly to moscow,fly,,http://dbpedia.org/ontology/targetAirport,,1,0,targetAirport,
Is Trevor Peacock the narrator of Fred Claus,narrator,,http://dbpedia.org/property/narrator,,1,0,narrator,
What all are written in the C programming language,programming language,,http://dbpedia.org/property/programmingLanguage,,2,0,programmingLanguage,
List the producer of the TV shows whose company is HBO.,company,producer,http://dbpedia.org/ontology/company,http://dbpedia.org/ontology/producer,1,1,company,producer
Is Andrew Lincoln the narrator of Million Dollar Traders,narrator,,http://dbpedia.org/ontology/narrator,,1,0,narrator,
List all the operators of the train who operates in Budapest,operator,operator,http://dbpedia.org/ontology/operator,http://dbpedia.org/ontology/operator,1,1,operator,operator
Is Eddie Bravo the trainer of Alan Jouban,trainer,,http://dbpedia.org/ontology/trainer,,1,0,trainer,
What are some common ingredients used in Swedish dishes,in,ingredient,http://dbpedia.org/ontology/country,http://dbpedia.org/ontology/ingredient,1,1,country,ingredient
"Where did the genres originate, which were in the Harry and the Potters album",genre,album,http://dbpedia.org/ontology/genre,http://dbpedia.org/ontology/stylisticOrigin,1,1,genre,stylisticOrigin
Whose former teams are Indianapolis Colts and Carolina Panthers,former team,former team,http://dbpedia.org/ontology/formerTeam,http://dbpedia.org/ontology/formerTeam,2,2,formerTeam,formerTeam
Name the river with mouth palce Essex and source place as Gloucestershire,place mouth,source place,http://dbpedia.org/ontology/mouthPlace,http://dbpedia.org/ontology/sourcePlace,2,2,mouthPlace,sourcePlace
Was Castillo discovered by Galileo,discovered by,,http://dbpedia.org/property/discoverer,,2,0,discoverer,
What are the common sports played by jamiatu Muslim mindanao and Polytechnic University of Philippines Taguig,Taguig,sport,http://dbpedia.org/ontology/athletics,http://dbpedia.org/ontology/sport,1,1,athletics,sport
Among the countries using Aureus as currency which had Nicomedia as an important place,place,currency,http://dbpedia.org/ontology/capital,http://dbpedia.org/ontology/currency,1,1,capital,currency
Who are the trainersof Candice Michelle,trainer,,http://dbpedia.org/ontology/trainer,,1,0,trainer,
Does StandBy records distribute via Sony,distribute,,http://dbpedia.org/ontology/distributingLabel,,1,0,distributingLabel,
Name the music artist which collaborated with the spouse of Jessi Colter,spouse,artist music,http://dbpedia.org/ontology/spouse,http://dbpedia.org/ontology/associatedMusicalArtist,1,2,spouse,associatedMusicalArtist
Who is the prime minister of the successor of Kingsley Wood,successor,minister prime,http://dbpedia.org/ontology/successor,http://dbpedia.org/property/primeminister,1,2,successor,primeminister
which band was Roger waters in,band,,http://dbpedia.org/ontology/formerBandMember,,1,0,formerBandMember,
Is Seattle the Ship builder of USS Marmora (IX-189),Ship builder,,http://dbpedia.org/property/shipBuilder,,2,0,shipBuilder,
Was Beth Tweddle primarily coached by Amanda Reddin,coached,,http://dbpedia.org/property/headcoach,,1,0,headcoach,
What is the Band whose band member is Mark Middleton,band member,,http://dbpedia.org/ontology/bandMember,,2,0,bandMember,
Was the cover of The adventures of Tom Sawyer designed by Mark Twain,cover,,http://dbpedia.org/ontology/coverArtist,,1,0,coverArtist,
Which president of William Eustus also married to Dolley Madison,married to,president,http://dbpedia.org/ontology/spouse,http://dbpedia.org/property/president,2,1,spouse,president
Is Charles Drummond Ellis a doctoral student of James Chadwick,doctoral student,,http://dbpedia.org/ontology/doctoralStudent,,2,0,doctoralStudent,
How many kings and queens have died in the Arabian Peninsula,died in,,http://dbpedia.org/ontology/deathPlace,,2,0,deathPlace,
What team did Joe Porter and Eddie Anderson play for,team,team,http://dbpedia.org/ontology/team,http://dbpedia.org/ontology/formerTeam,1,1,team,formerTeam
Producers of what have died in Mississippi,died in,Producer,http://dbpedia.org/ontology/deathPlace,http://dbpedia.org/ontology/producer,2,1,deathPlace,producer
How many universities are there whose country's capital is Oslo,capital,country,http://dbpedia.org/property/capital,http://dbpedia.org/ontology/country,1,1,capital,country
Current players of Colorado Avalanche have previously played for how many different teams,played for,teams,http://dbpedia.org/ontology/team,http://dbpedia.org/ontology/formerTeam,2,1,team,formerTeam
Was 2658 Gingerich invented in Harvard,invented,,http://dbpedia.org/ontology/discoverer,,1,0,discoverer,
How many other people are in a band with Robert de Niro,people,band,http://dbpedia.org/property/currentMembers,http://dbpedia.org/ontology/bandMember,1,1,currentMembers,bandMember
Is Philosophy the academic discipline of Think (journal),academic discipline,,http://dbpedia.org/ontology/academicDiscipline,,2,0,academicDiscipline,
What is the highschool of the american football player who joined the Robert Morris Colonials program,school,highschool,http://dbpedia.org/ontology/school,http://dbpedia.org/property/highschool,1,1,school,highschool
Who is associated  with the musical artists from Africa '70 (band) and Tony Allen,associated musical,associated musical,http://dbpedia.org/ontology/associatedMusicalArtist,http://dbpedia.org/ontology/associatedMusicalArtist,2,2,associatedMusicalArtist,associatedMusicalArtist
How many religions are followed by the group whose architectural style can be seen on Sanggar Agung,architectural style,religion,http://dbpedia.org/property/architecturalStyle,http://dbpedia.org/ontology/religion,2,1,architecturalStyle,religion
Name the other wine region of the grapes whose one of the wine region is Michigan,wine region,wine region,http://dbpedia.org/ontology/wineRegion,http://dbpedia.org/ontology/wineRegion,2,2,wineRegion,wineRegion
Which shows' opening themes was used to make If We Were a Movie,make,opening theme,http://dbpedia.org/ontology/subsequentWork,http://dbpedia.org/ontology/openingTheme,1,2,subsequentWork,openingTheme
Does GeneWeb have the GPL license,license,,http://dbpedia.org/property/license,,1,0,license,
Josef Bhler belongs to which political party,party,,http://dbpedia.org/ontology/occupation,,1,0,occupation,
What are the beverages whose origin is England,origin,,http://dbpedia.org/ontology/origin,,1,0,origin,
List down the opponents of Frank Stilwell,opponent,,http://dbpedia.org/ontology/opponent,,1,0,opponent,
How many subjects are covered in the publications of Doubleday,publications,subjects,http://dbpedia.org/ontology/publisher,http://dbpedia.org/ontology/nonFictionSubject,1,1,publisher,nonFictionSubject
Is Olyokma River the right tributary of Lena River,right tributary,,http://dbpedia.org/ontology/rightTributary,,2,0,rightTributary,
What is the debut team of the football player whose college is UCLA Bruins football,college,debut team,http://dbpedia.org/ontology/college,http://dbpedia.org/ontology/debutTeam,1,2,college,debutTeam
What is the capital of the region which maintains the South Park Bridge,maintains,capital,http://dbpedia.org/ontology/maintainedBy,http://dbpedia.org/ontology/countySeat,1,1,maintainedBy,countySeat
Who has military branches are Colonial troops and Continental Army,military branch,military branch,http://dbpedia.org/ontology/militaryBranch,http://dbpedia.org/ontology/militaryBranch,2,2,militaryBranch,militaryBranch
In how many places has Don R. Berlin worked,places,,http://dbpedia.org/ontology/employer,,1,0,employer,
Was Heinrich Himmler ever a commanders of Army Group Oberrhein,commanders,,http://dbpedia.org/property/notableCommanders,,1,0,notableCommanders,
Name the cause of death of Martino Martini,death cause,,http://dbpedia.org/ontology/deathCause,,2,0,deathCause,
What is the total number of fictional characters whose created by  Greg Daniels and series is The Office (U.S. TV series),created by,series,http://dbpedia.org/ontology/creator,http://dbpedia.org/ontology/series,2,1,creator,series
"Fairfield, Connecticut is hometown to which persons",hometown,,http://dbpedia.org/ontology/hometown,,1,0,hometown,
Which administrative region leader is Sukhumbhand Paribatra and was founded by  Rama I,leader,was founded by,http://dbpedia.org/ontology/leaderName,http://dbpedia.org/ontology/founder,1,3,leaderName,founder
Is Luigi Brugnaro the mayor of Venice,mayor,,http://dbpedia.org/property/mayor,,1,0,mayor,
Where did Allama Matthews study,study,,http://dbpedia.org/ontology/college,,1,0,college,
Politicians born in Bangalore are now in which parties,born,parties,http://dbpedia.org/property/homeTown,http://dbpedia.org/ontology/party,1,1,homeTown,party
What is the nationality of the chancellor who was served by Michael Mayr,served,nationality,http://dbpedia.org/ontology/deputy,http://dbpedia.org/ontology/nationality,1,1,deputy,nationality
Is joel quenneville the main coach of Chicago Blackhawks,coach,,http://dbpedia.org/property/headCoach,,1,0,headCoach,
Quebec born ice hockey players have stopped playing for which teams,playing,teams,http://dbpedia.org/ontology/birthPlace,http://dbpedia.org/ontology/formerTeam,1,1,birthPlace,formerTeam
How many genres gave birth to other genres which emphasize Bass Guitars,emphasize,emphasize,http://dbpedia.org/property/instruments,http://dbpedia.org/ontology/stylisticOrigin,1,1,instruments,stylisticOrigin
Who developed the software for the operating system of Macintosh Quadra 660AV,operating system,developed,http://dbpedia.org/ontology/operatingSystem,http://dbpedia.org/ontology/developer,2,1,operatingSystem,developer
Who is the writer with notable works like Adventures of Huckleberry Finn and The Adventures of Tom Sawyer,notable work,notable work,http://dbpedia.org/ontology/notableWork,http://dbpedia.org/ontology/notableWork,2,2,notableWork,notableWork
How many politicians are there from the city of Ganges,city,politicians,http://dbpedia.org/property/city,http://dbpedia.org/ontology/leaderName,1,1,city,leaderName
What genre's softwares are released with a GNU GPL license,license,genre,http://dbpedia.org/property/license,http://dbpedia.org/property/genre,1,1,license,genre
How many shows are made by Playtone,made,,http://dbpedia.org/property/company,,1,0,company,
Name the monarch of L Buwei,monarch,,http://dbpedia.org/ontology/monarch,,1,0,monarch,
"Who were the commanders during the events which took place in Sandusky County, Ohio",place,commander,http://dbpedia.org/ontology/place,http://dbpedia.org/ontology/commander,1,1,place,commander
"What are the movies whose editor died in Westwood, Los Angeles",died in,editor,http://dbpedia.org/ontology/deathPlace,http://dbpedia.org/ontology/editing,2,1,deathPlace,editing
In how many places can I find people who were the architects of the Dundas Castle,architects,people,http://dbpedia.org/property/architecture,http://dbpedia.org/property/region,1,1,architecture,region
Count the movies in Swedish language,language,,http://dbpedia.org/property/language,,1,0,language,
Name the artist of Brad Paisley discography,artist,,http://dbpedia.org/property/artist,,1,0,artist,
"From how many works is the musical derived, whose lyrics are written by Sheldon Harnick",lyrics,written,http://dbpedia.org/property/lyrics,http://dbpedia.org/ontology/basedOn,1,1,lyrics,basedOn
