Questions,label1,label2,uri1,uri2,label1len,label2len,uri1Label,uri2Label
Which destination of the Novair International Airways is also the  predecessor of the Chevrolet Caprice,destination,predecessor,http://dbpedia.org/ontology/destination,http://dbpedia.org/ontology/predecessor,1,1,destination,predecessor
What are some scientists who have stateless citizenship,citizenship,,http://dbpedia.org/ontology/citizenship,,1,0,citizenship,
which awards have been given to people who fought in the Battle of France,Battle,awards,http://dbpedia.org/ontology/battle,http://dbpedia.org/ontology/award,1,1,battle,award
How many people have been trained in an institute located in California,in,trained,http://dbpedia.org/property/city,http://dbpedia.org/property/training,1,1,city,training
Which composer subsequent work of Moondog Matinee and also composed The TImes They are A changin,composer,subsequent work,http://dbpedia.org/ontology/musicBy,http://dbpedia.org/ontology/subsequentWork,1,2,musicBy,subsequentWork
Name whose youth club was FC Barcelona,youth club,,http://dbpedia.org/property/youthclubs,,2,0,youthclubs,
What is the citizenship of Erastus Wiman,citizenship,,http://dbpedia.org/ontology/citizenship,,1,0,citizenship,
Does the Amazon River start in Arequipa Region,region,,http://dbpedia.org/property/sourceRegion,,1,0,sourceRegion,
Which is the nearest city to Elliott Bay,nearest city,,http://dbpedia.org/ontology/nearestCity,,2,0,nearestCity,
List the movie whose music was given by Geoffrey Burgon and distributed by Cinema International Corporation,music,distributed by,http://dbpedia.org/ontology/musicComposer,http://dbpedia.org/ontology/distributor,1,2,musicComposer,distributor
Which football teams is Shahid Khan proprietor to,proprietor,,http://dbpedia.org/ontology/owner,,1,0,owner,
How many cities are around the sea in which the the fig tree bay meets,in,cities,http://dbpedia.org/ontology/inflow,http://dbpedia.org/property/cities,1,1,inflow,cities
What are all the prizes won by the writer of A Grand Day Out,writer,won,http://dbpedia.org/ontology/writer,http://dbpedia.org/ontology/award,1,1,writer,award
Count the number of families of the Animal kingdom.,kingdom,families,http://dbpedia.org/ontology/kingdom,http://dbpedia.org/ontology/family,1,1,kingdom,family
Which magazine has publisher as Jann Wenner,publisher,,http://dbpedia.org/ontology/publisher,,1,0,publisher,
"Where is the ground of the soccer club, which has Alan Kusov as a team member",team,ground,http://dbpedia.org/ontology/team,http://dbpedia.org/ontology/ground,1,1,team,ground
"Give the name of the river with source place as Australian Alps and has mouth place as Goolwa , a place in Siyuth Australia",source place,mouth place,http://dbpedia.org/ontology/sourcePlace,http://dbpedia.org/ontology/mouthPlace,2,2,sourcePlace,mouthPlace
Did Trish Stratus train Christina Crawford,train,,http://dbpedia.org/property/trainer,,1,0,trainer,
Who is the writer of the Cavalcade of America and The United States Steel Hour,writer,writer,http://dbpedia.org/ontology/writer,http://dbpedia.org/ontology/writer,1,1,writer,writer
Count the total religions followed by the ones living in England.,living,religion,http://dbpedia.org/property/residence,http://dbpedia.org/property/religion,1,1,residence,religion
Name the cover artist of the adventure of Tom sawyer,cover artist,,http://dbpedia.org/ontology/coverArtist,,2,0,coverArtist,
Which river flows through both eastern and western washington,river,river,http://dbpedia.org/ontology/river,http://dbpedia.org/ontology/river,1,1,river,river
What is the nationality of the golf player who won the  2002 Players Championship,Champion,nationality,http://dbpedia.org/ontology/champion,http://dbpedia.org/ontology/nationality,1,1,champion,nationality
Which companies are founded in the city of which Collin County Texas is a part,part,founded,http://dbpedia.org/ontology/part,http://dbpedia.org/ontology/foundationPlace,1,1,part,foundationPlace
Which home stadium of 2011-12 FC Spartak Moscow season is also the location of birth of the Svetlana Gounkina,home stadium,location of birth,http://dbpedia.org/ontology/homeStadium,http://dbpedia.org/ontology/birthPlace,2,3,homeStadium,birthPlace
Who is the former partner of Chris Knierim,former partner,,http://dbpedia.org/ontology/formerPartner,,2,0,formerPartner,
"How many different pole drivers are there, of the GPs when Renault was the first team",first team,pole driver,http://dbpedia.org/property/firstTeam,http://dbpedia.org/ontology/poleDriver,2,2,firstTeam,poleDriver
What are all the TV shows which are related to the ones produced by Julie Gardner,produced,related,http://dbpedia.org/ontology/executiveProducer,http://dbpedia.org/ontology/related,1,1,executiveProducer,related
Name the parent company of  Ford Air Transport Service,parent company,,http://dbpedia.org/ontology/parentCompany,,2,0,parentCompany,
How many people have worked in the band one of whose current member is Hynief,current member,member band,http://dbpedia.org/property/currentMembers,http://dbpedia.org/ontology/bandMember,2,2,currentMembers,bandMember
Does Mt St. Peter Churt follow the architectural style of art deco,architectural style,,http://dbpedia.org/property/architecture,,2,0,architecture,
King crimson has been recorded in which places,places,recorded in,http://dbpedia.org/ontology/artist,http://dbpedia.org/ontology/recordedIn,1,2,artist,recordedIn
Is william doyle the chairman of Georgetown university,chairman,,http://dbpedia.org/property/chairman,,1,0,chairman,
Count me all the video game distributor whose parent company is Warner Bros,parent,distributor,http://dbpedia.org/property/parent,http://dbpedia.org/property/distributor,1,1,parent,distributor
Was Elizabeth Ann Seton canonized by Pope Paul VI,canonized by,,http://dbpedia.org/property/canonizedBy,,2,0,canonizedBy,
Is Sao Paulo the largest city of Brazil,largest city,,http://dbpedia.org/property/largestCity,,2,0,largestCity,
Does Ford own the Ford Kansas Assembly plant,Ford own,,http://dbpedia.org/ontology/owningOrganisation,,2,0,owningOrganisation,
Was David Gilmour a former member of Pink Floyd,member former,,http://dbpedia.org/ontology/formerBandMember,,2,0,formerBandMember,
Which ppolitical party of Yashpal Kapur is also the owner of National Herald,owner,political party,http://dbpedia.org/ontology/owner,http://dbpedia.org/ontology/party,1,2,owner,party
Name the sstadium of 2015 Pro Duta FC season,stadium,,http://dbpedia.org/property/stadium,,1,0,stadium,
What awards have been given to citizens of the Ottoman Empire,citizens,awards,http://dbpedia.org/ontology/citizenship,http://dbpedia.org/ontology/award,1,1,citizenship,award
List the state of the universities whose nation is United States,nation,nation,http://dbpedia.org/ontology/country,http://dbpedia.org/ontology/state,1,1,country,state
What are the software whose operating systems are Mac OS and Microsoft Windows,operating system,operating system,http://dbpedia.org/ontology/operatingSystem,http://dbpedia.org/ontology/operatingSystem,2,2,operatingSystem,operatingSystem
Does the Utah State Route 162 end at Colorado,route end,,http://dbpedia.org/ontology/routeEnd,,2,0,routeEnd,
Is jim harbaugh currently in the Michigan Wolverines,currently,,http://dbpedia.org/property/currentteam,,1,0,currentteam,
"How many awards have been received by graduates of University of Melbourne, Faculty of VCA & MCM",MCM,awards,http://dbpedia.org/ontology/training,http://dbpedia.org/ontology/award,1,1,training,award
"To which books Thomas Egerton, an editor",editor,,http://dbpedia.org/ontology/publisher,,1,0,publisher,
Was christina crawford trained by Booker T,trained,,http://dbpedia.org/property/trainer,,1,0,trainer,
In how many places has Garbage recorded their songs,songs,recorded in,http://dbpedia.org/ontology/producer,http://dbpedia.org/ontology/recordedIn,1,2,producer,recordedIn
What award was won by executive producer of Shaun the Sheep,executive producer,award,http://dbpedia.org/ontology/executiveProducer,http://dbpedia.org/ontology/award,2,1,executiveProducer,award
What is the television show whose opening theme's album is Cheers,album,opening theme,http://dbpedia.org/ontology/album,http://dbpedia.org/ontology/openingTheme,1,2,album,openingTheme
Which driver had the pole position in 1994 Spanish Grand Prix,driver pole,,http://dbpedia.org/ontology/poleDriver,,2,0,poleDriver,
How many different religions have economists followed,economists,religion,http://dbpedia.org/ontology/profession,http://dbpedia.org/ontology/religion,1,1,profession,religion
What is the automobile platform of Chiva bus,automobile platform,,http://dbpedia.org/ontology/automobilePlatform,,2,0,automobilePlatform,
What borders siberia,border,,http://dbpedia.org/ontology/border,,1,0,border,
How many had their debut team coached by Chip Kelly,coach,debut team,http://dbpedia.org/property/coach,http://dbpedia.org/ontology/debutTeam,1,2,coach,debutTeam
Did John Byrne create Emma Frost,create,,http://dbpedia.org/property/creators,,1,0,creators,
What is the device whose successor's CPU is by AMD,CPU,successor,http://dbpedia.org/ontology/cpu,http://dbpedia.org/ontology/successor,1,1,cpu,successor
"Who was the coach of marquette Golden Eagles men's basketball team-2012,13 season",coach,,http://dbpedia.org/ontology/coach,,1,0,coach,
What made Jon Speelman and Eric Schiller famous,famous,famous,http://dbpedia.org/ontology/field,http://dbpedia.org/ontology/knownFor,1,1,field,knownFor
Which manufacturer of the Boeing B-17 Flying fortress is the manager of burro Flats Painted Caves,manager,manufacturer,http://dbpedia.org/ontology/governingBody,http://dbpedia.org/ontology/manufacturer,1,1,governingBody,manufacturer
How many people currently play for Stoke City F.C.,currently,,http://dbpedia.org/property/currentclub,,1,0,currentclub,
In how many different places can I find companies which were founded in toronto,founded,companies,http://dbpedia.org/ontology/foundationPlace,http://dbpedia.org/property/locations,1,1,foundationPlace,locations
How many organizations own the website to which Jimmy Wales contributes,contributes,own,http://dbpedia.org/ontology/author,http://dbpedia.org/ontology/owner,1,1,author,owner
List the former team of the american football players born in Pennsylvania,born in,former team,http://dbpedia.org/ontology/birthPlace,http://dbpedia.org/ontology/formerTeam,2,2,birthPlace,formerTeam
Through how many cities does the river flowing into Arkansas go,river,in,http://dbpedia.org/ontology/mouthMountain,http://dbpedia.org/ontology/city,1,1,mouthMountain,city
who are the managers of england national under 20 football team,managers,,http://dbpedia.org/property/managerclubs,,1,0,managerclubs,
Did Jim Kiick do his highschool in New Jersey,highschool,,http://dbpedia.org/property/highSchool,,1,0,highSchool,
What shows are on the networks which are from the United States,from,network,http://dbpedia.org/ontology/locationCountry,http://dbpedia.org/property/network,1,1,locationCountry,network
Was the song The Boy is Mine recorded in Atlanta,recorded,,http://dbpedia.org/property/recorded,,1,0,recorded,
How many things do bridges designed by the UEM group go over,designed,over,http://dbpedia.org/property/designer,http://dbpedia.org/property/crosses,1,1,designer,crosses
Who is the fictional character who portrayed in Terminator 2: Judgment Day,portrayed,,http://dbpedia.org/ontology/portrayer,,1,0,portrayer,
Which movies' music is composed by people associated with the band Yes,associated music,composed,http://dbpedia.org/ontology/associatedMusicalArtist,http://dbpedia.org/ontology/musicComposer,2,1,associatedMusicalArtist,musicComposer
What is the death place of the Marina Pankova and Viktor Ulyanich,death place,death place,http://dbpedia.org/ontology/deathPlace,http://dbpedia.org/ontology/deathPlace,2,2,deathPlace,deathPlace
What famous work is derived from the one whose lyrics are written by Inma Gonzales,lyrics,derived from,http://dbpedia.org/ontology/lyrics,http://dbpedia.org/ontology/basedOn,1,2,lyrics,basedOn
How many services are there of the companies whose services is Web hosting service,services,services,http://dbpedia.org/property/services,http://dbpedia.org/property/services,1,1,services,services
By which university is the literary magazine named Stone Canoe published,published,,http://dbpedia.org/ontology/publisher,,1,0,publisher,
How many politicians are in the militia,politicians,,http://dbpedia.org/property/branch,,1,0,branch,
Name the rivers whose source country's capital is Lusaka,capital,source country,http://dbpedia.org/ontology/capital,http://dbpedia.org/ontology/sourceCountry,1,2,capital,sourceCountry
Some movies whose screenplay is done by american born people,people,screenplay,http://dbpedia.org/ontology/birthPlace,http://dbpedia.org/property/screenplay,1,1,birthPlace,screenplay
Who is the narrator of The Price of Beauty,narrator,,http://dbpedia.org/ontology/narrator,,1,0,narrator,
Enumerate all those who are in the Board of companies founded in New York,founded,Board,http://dbpedia.org/property/foundation,http://dbpedia.org/ontology/board,1,1,foundation,board
Who did Bruce Bochy play for,play,,http://dbpedia.org/ontology/team,,1,0,team,
Was Michael Schumacher a pole driver in the 1999 GP,pole driver,,http://dbpedia.org/property/poleDriver,,2,0,poleDriver,
How many universities participate in the NCAA Division I Football Bowl Subdivision,participate,,http://dbpedia.org/property/athletics,,1,0,athletics,
How many religion's people have died in Malaysia,died in,religion,http://dbpedia.org/ontology/deathPlace,http://dbpedia.org/ontology/religion,2,1,deathPlace,religion
How many people have managed a club which owns the Riverside Stadium,owns,managed,http://dbpedia.org/property/ground,http://dbpedia.org/ontology/managerClub,1,1,ground,managerClub
How many other wine region are there of the grapes whose one of the wine region is Michigan,wine region,wine region,http://dbpedia.org/ontology/wineRegion,http://dbpedia.org/ontology/wineRegion,2,2,wineRegion,wineRegion
To which families does the Koolakamba belong,families,,http://dbpedia.org/ontology/family,,1,0,family,
How many awards have screenwriters won,won,awards,http://dbpedia.org/ontology/occupation,http://dbpedia.org/ontology/award,1,1,occupation,award
List the countries through which European rout E39 and E8 passes,passes,passes,http://dbpedia.org/ontology/county,http://dbpedia.org/ontology/county,1,1,county,county
How many people work at the FBI,work,,http://dbpedia.org/ontology/occupation,,1,0,occupation,
Count the nearest city to the historic palce whose one of the nearest city is Wisconsin,nearest city,nearest city,http://dbpedia.org/ontology/nearestCity,http://dbpedia.org/property/nearestCity,2,2,nearestCity,nearestCity
What is the airline company has its headquarters in Dublin Airport,headquarters,,http://dbpedia.org/property/headquarters,,1,0,headquarters,
What are some orthonychidae birds,orthonychidae birds,,http://dbpedia.org/ontology/family,,2,0,family,
Is Dave Schulz a band member of Berlin,band member,,http://dbpedia.org/ontology/bandMember,,2,0,bandMember,
Does MSX BASIC have a license of microsoft,license,,http://dbpedia.org/property/license,,1,0,license,
List the subsequent work of the albums whose one of the subsequent work is Planet Waves,subsequent work,subsequent work,http://dbpedia.org/ontology/subsequentWork,http://dbpedia.org/ontology/subsequentWork,2,2,subsequentWork,subsequentWork
In which mountain Inyo National Forest and California are located,Nation,Nation,http://dbpedia.org/ontology/locatedInArea,http://dbpedia.org/ontology/locatedInArea,1,1,locatedInArea,locatedInArea
Was the Incredibles released before Finding Nemo,released,,http://dbpedia.org/ontology/previousWork,,1,0,previousWork,
How many thesis were supervised by Ernest Rutherford,supervised,,http://dbpedia.org/ontology/doctoralAdvisor,,1,0,doctoralAdvisor,
What is the television show whose related with  Doctor Who Confidential,related,,http://dbpedia.org/ontology/related,,1,0,related,
What are the last two studio albums of Moondog Matinee,two,,http://dbpedia.org/ontology/subsequentWork,,1,0,subsequentWork,
How many people currently play for the NYC FC,currently,,http://dbpedia.org/property/currentclub,,1,0,currentclub,
Is Gutenberg neighbouring with Madiswil,Gutenberg,,http://dbpedia.org/property/neighboringMunicipalities,,1,0,neighboringMunicipalities,
What is the total number of writers whose singles are recorded in Miami,recorded in,writers,http://dbpedia.org/ontology/recordedIn,http://dbpedia.org/property/writer,2,1,recordedIn,writer
Daniel L D Granger and Job Durfee have based their political career in which US state,state,state,http://dbpedia.org/property/state,http://dbpedia.org/property/state,1,1,state,state
Who are the employer of Don R. Berlin,employer,,http://dbpedia.org/ontology/employer,,1,0,employer,
How many different mascots are there of the NCAA teams,teams,mascot,http://dbpedia.org/property/athletics,http://dbpedia.org/property/mascot,1,1,athletics,mascot
What is the river whose tributary is Zarqa River,tributary,,http://dbpedia.org/ontology/leftTributary,,1,0,leftTributary,
How many home stadiums are there of the seasons whose chairman in Merritt Paulson,chairman,home stadium,http://dbpedia.org/ontology/chairman,http://dbpedia.org/ontology/homeStadium,1,2,chairman,homeStadium
Give me the count of all the names of characters created by Frank Miller,created by,characters,http://dbpedia.org/property/creators,http://dbpedia.org/property/characterName,2,1,creators,characterName
Give me a count of bridges located in California,in,,http://dbpedia.org/ontology/locatedInArea,,1,0,locatedInArea,
List the companies operating in Australia,operating,,http://dbpedia.org/ontology/regionServed,,1,0,regionServed,
"What all are in the states whose anthem is Ja, vi esker dette landet",anthem,state,http://dbpedia.org/ontology/anthem,http://dbpedia.org/ontology/country,1,1,anthem,country
Which country are the players of the Atletico Petroleos de Luanda from,players,country,http://dbpedia.org/ontology/club,http://dbpedia.org/ontology/nationality,1,1,club,nationality
Who owns the ford kansas assembly plant,owns,,http://dbpedia.org/ontology/owningOrganisation,,1,0,owningOrganisation,
Which saints were the messengers of Islam,messengers,,http://dbpedia.org/ontology/veneratedIn,,1,0,veneratedIn,
Companies founded in Taiwan have typically which divisions,founded,division,http://dbpedia.org/ontology/foundationPlace,http://dbpedia.org/ontology/division,1,1,foundationPlace,division
"What is the hub airport of Pawan Hans, and is also the largest city of India",hub airport,largest city,http://dbpedia.org/ontology/hubAirport,http://dbpedia.org/ontology/largestCity,2,2,hubAirport,largestCity
Name the source of Raa,source,,http://dbpedia.org/ontology/source,,1,0,source,
Was Nick Jonas a member of the Jonas Brothers,member,,http://dbpedia.org/property/pastMembers,,1,0,pastMembers,
Movie's produced by Michael Deeley has Jordan Cronenweth as director of photography,produced,photography,http://dbpedia.org/ontology/producer,http://dbpedia.org/ontology/cinematography,1,1,producer,cinematography
Which cities have the river one of whose Tributary is the Missouri's big spring,tributary,in,http://dbpedia.org/ontology/rightTributary,http://dbpedia.org/ontology/city,1,1,rightTributary,city
Which band was left by Kevin Jonas,band,,http://dbpedia.org/ontology/formerBandMember,,1,0,formerBandMember,
return some  players who have played in the NBA,played,,http://dbpedia.org/property/league,,1,0,league,
How many have been venerateds in Islam and Judaism,venerateds,venerateds,http://dbpedia.org/ontology/veneratedIn,http://dbpedia.org/ontology/veneratedIn,1,1,veneratedIn,veneratedIn
What is the resting place of the politician who succeeded Samuel Hayes,succeeded,resting place,http://dbpedia.org/ontology/successor,http://dbpedia.org/ontology/restingPlace,1,2,successor,restingPlace
Is Amharic the official language of Ethiopia,official language,,http://dbpedia.org/ontology/officialLanguage,,2,0,officialLanguage,
Which religion did both anupong paochinda and udit raj follow,religion,religion,http://dbpedia.org/ontology/religion,http://dbpedia.org/ontology/religion,1,1,religion,religion
What is the source country of reg Lake,source country,,http://dbpedia.org/ontology/sourceCountry,,2,0,sourceCountry,
What is the television show whose cast members are Jeff Conaway and Jason Carter,members,members,http://dbpedia.org/ontology/starring,http://dbpedia.org/ontology/starring,1,1,starring,starring
The successor of Ellsworth Bunker belongs to which religion,successor,religion,http://dbpedia.org/ontology/successor,http://dbpedia.org/ontology/region,1,1,successor,region
Is God Save the Queen the national anthem of United Kingdom,national anthem,,http://dbpedia.org/property/nationalAnthem,,2,0,nationalAnthem,
GetTV is owned by which organisation,organisation,,http://dbpedia.org/ontology/parentOrganisation,,1,0,parentOrganisation,
Was saddam hussein at the rank of Mushir ever,rank,,http://dbpedia.org/property/rank,,1,0,rank,
How many factions were involved in the battles fought by Arthur St. Clair,battles,fought,http://dbpedia.org/property/battles,http://dbpedia.org/property/combatant,1,1,battles,combatant
List borders of the admin region bordering Arctic ocean,border,border,http://dbpedia.org/ontology/border,http://dbpedia.org/ontology/border,1,1,border,border
Is Giorgos Kaminis the mayor of Athens,mayor,,http://dbpedia.org/ontology/mayor,,1,0,mayor,
In which military conflict were Phm Vn ng and John McEwen commanders,commander,commander,http://dbpedia.org/ontology/commander,http://dbpedia.org/ontology/commander,1,1,commander,commander
Does Air 2000 fly to the north american continent,fly,,http://dbpedia.org/ontology/destination,,1,0,destination,
How many players debuted their careers from San Francisco 49ers,debuted,,http://dbpedia.org/ontology/debutTeam,,1,0,debutTeam,
What movies have been written by authors of Monty Python,written by,,http://dbpedia.org/ontology/writer,,2,0,writer,
Did Bob Dylan write the lyrics of the times they are a changin',lyrics,,http://dbpedia.org/property/lyrics,,1,0,lyrics,
How many saints have been venerated in Judaism,venerated in,,http://dbpedia.org/ontology/veneratedIn,,2,0,veneratedIn,
What is the military unit whose command structures are United States Department of the Navy and United States Department of Defense,command structure,command structure,http://dbpedia.org/ontology/commandStructure,http://dbpedia.org/ontology/commandStructure,2,2,commandStructure,commandStructure
Is James Wong Howe the cinematographer of Behave Yourself,cinematographer,,http://dbpedia.org/property/cinematography,,1,0,cinematography,
What awards have the alumni of Academy of Fine Arts in Lodz achieved,achieved,awards,http://dbpedia.org/ontology/training,http://dbpedia.org/ontology/award,1,1,training,award
How many TV shows are of the company which are of company which is a subsidiary of Big  Ticket Entertainment,subsidiary,company,http://dbpedia.org/ontology/subsidiary,http://dbpedia.org/property/company,1,1,subsidiary,company
Which are the predecessor of Chevrolet Caprice,predecessor,,http://dbpedia.org/ontology/predecessor,,1,0,predecessor,
Name the sports played by Fr. Agnel Multipurpose School and Junior College,sport,,http://dbpedia.org/ontology/sport,,1,0,sport,
Which athletics of Jaimatu Muslim Mindano is same as the genre of the Fritz Chess,athletics,genre,http://dbpedia.org/ontology/athletics,http://dbpedia.org/ontology/genre,1,1,athletics,genre
In what battles did president Park Chung-hee participate,participate,,http://dbpedia.org/ontology/commander,,1,0,commander,
Is stephanie a female,female,,http://dbpedia.org/property/gender,,1,0,gender,
What is the layout of the automobiles whose designer company is Olivier Boulay,designer company,layout,http://dbpedia.org/ontology/designCompany,http://dbpedia.org/ontology/layout,2,1,designCompany,layout
Count the number of religions followed by BJP members.,number,religion,http://dbpedia.org/property/party,http://dbpedia.org/ontology/religion,1,1,party,religion
How many people have been the head coach for Middlesbrough FC,head,coach,http://dbpedia.org/property/club,http://dbpedia.org/ontology/manager,1,1,club,manager
Who was on the boards of Freedom of the City and Royal Society,board,board,http://dbpedia.org/ontology/board,http://dbpedia.org/ontology/board,1,1,board,board
What games are played at universities in Lanao Del Sur,in,played,http://dbpedia.org/ontology/state,http://dbpedia.org/ontology/athletics,1,1,state,athletics
What is the almamater of the president whose vice president was Enrique Jos Varona,vice president,almamater,http://dbpedia.org/ontology/vicePresident,http://dbpedia.org/ontology/almaMater,2,1,vicePresident,almaMater
"What is the architecture of First National Bank and Trust Building (Lima, Ohio)",architecture,,http://dbpedia.org/ontology/architecturalStyle,,1,0,architecturalStyle,
In which states does the river flow whose left tributary is Toms Creek,left tributary,state,http://dbpedia.org/ontology/leftTributary,http://dbpedia.org/ontology/state,2,1,leftTributary,state
Which animator of the The Skeleton Dance is also the director of The Haunted House (1929 film),animator,director,http://dbpedia.org/ontology/animator,http://dbpedia.org/ontology/director,1,1,animator,director
How many people won the Gold Medal of the Royal Astronomical Society,won,,http://dbpedia.org/property/prizes,,1,0,prizes,
Stockholm is the HQ of how many things,HQ,,http://dbpedia.org/property/headquarters,,1,0,headquarters,
With whom were the engagements of Alpine Brigade Taurinense,engagements,,http://dbpedia.org/ontology/battle,,1,0,battle,
