Questions,label1,label2,uri1,uri2,label1len,label2len,uri1Label,uri2Label
What were the awards won by the founder of Walt Disney Records,founder of,awards,http://dbpedia.org/ontology/foundedBy,http://dbpedia.org/ontology/award,2,1,foundedBy,award
"Which river goes through cohoes, NY",river,,http://dbpedia.org/ontology/river,,1,0,river,
Is the Columbia University chaired by William Campbell,chaired,,http://dbpedia.org/ontology/chairman,,1,0,chairman,
which movies have been published by Cinema International Corporation,published,,http://dbpedia.org/ontology/distributor,,1,0,distributor,
Where the children of Ashot Grashi employed at,,employed,http://dbpedia.org/ontology/parent,http://dbpedia.org/ontology/occupation,0,1,parent,occupation
In what wars was Steve Buyer involved,war,,http://dbpedia.org/ontology/battle,,1,0,battle,
Was Michael Schumacher the Pole driver of 1994 Spanish Grand Prix,Pole driver,,http://dbpedia.org/property/poleDriver,,2,0,poleDriver,
"What is the style of architecture of Shaheed Minar, Kolkata",style of architecture,,http://dbpedia.org/ontology/architecturalStyle,,3,0,architecturalStyle,
Count the number of characters in Batman Live,characters,,http://dbpedia.org/property/characters,,1,0,characters,
Is San Salvador Island a part of the Bahamas,part,,http://dbpedia.org/ontology/archipelago,,1,0,archipelago,
Is Michelle D. Johnson the superintendent of United States Air Force Academy,superintendent,,http://dbpedia.org/property/superintendent,,1,0,superintendent,
Did Stanlee write the Tales of Suspense,write,,http://dbpedia.org/property/writers,,1,0,writers,
Which basketball players have played in the league of National Basketball Association,league,,http://dbpedia.org/ontology/league,,1,0,league,
How many companies were founded in places where Dallas is the governing body,governing body,founded,http://dbpedia.org/property/governingBody,http://dbpedia.org/ontology/foundationPlace,2,1,governingBody,foundationPlace
"to which university did both, the Stanford Cardinal and Gerald Reaven go",university,,http://dbpedia.org/ontology/university,http://dbpedia.org/ontology/institution,1,0,university,institution
Which BBC's TV show is related with the Sarah Jane Adventures,TV,related,http://dbpedia.org/ontology/network,http://dbpedia.org/ontology/related,1,1,network,related
Who were the first drivers in the grand prix which took place at Autodromo Enzo e Dino Ferrari,place,first driver,http://dbpedia.org/ontology/location,http://dbpedia.org/ontology/firstDriver,1,2,location,firstDriver
How many cars succeed the cars assembled in Canada,assembled,assembled,http://dbpedia.org/property/assembly,http://dbpedia.org/ontology/predecessor,1,1,assembly,predecessor
How many books are written by the author who is famous for Novelas Ejemplares,famous,written by,http://dbpedia.org/ontology/notableWork,http://dbpedia.org/ontology/author,1,2,notableWork,author
To which city does Northeast Library belong,city,,http://dbpedia.org/ontology/city,,1,0,city,
What beverages originate in Leuven,origin,,http://dbpedia.org/ontology/origin,,1,0,origin,
List the common sports between Fr. Agnel Multipurpose School  and Jamiatu Muslim Mindanao,sport,School,http://dbpedia.org/ontology/sport,http://dbpedia.org/ontology/athletics,1,1,sport,athletics
Which football managers managed Middlesbrough F.C.,managers,,http://dbpedia.org/ontology/managerClub,,1,0,managerClub,
Who coached the Marquette golden eagles men team in 09 to 10 and then again in 13 to 14,coach,coach,http://dbpedia.org/ontology/coach,http://dbpedia.org/ontology/coach,1,1,coach,coach
What developed EMMS,developed,,http://dbpedia.org/ontology/developer,,1,0,developer,
Which city is the route start of the Moscow-Kazan high-speed railway and birth place of the Ilya Savelev,route start,birth place,http://dbpedia.org/ontology/routeStart,http://dbpedia.org/ontology/birthPlace,2,2,routeStart,birthPlace
Count the number of sports played by university which also plays Taekwondo,plays,plays,http://dbpedia.org/property/athletics,http://dbpedia.org/property/athletics,1,1,athletics,athletics
Is Grand Bahama lie in the achipelago of the bahamas,lie,,http://dbpedia.org/property/archipelago,,1,0,archipelago,
How many companies were started in the states,states,,http://dbpedia.org/ontology/foundationPlace,,1,0,foundationPlace,
How many bands are signed up with Kobalt Label Services,Label,,http://dbpedia.org/ontology/recordLabel,,1,0,recordLabel,
From how many countries did the aeroplanes designed by Alexander Lippisch originate,designed,originate,http://dbpedia.org/property/designer,http://dbpedia.org/property/nationalOrigin,1,1,designer,nationalOrigin
How many people are famous for the Gibson Les Paul,famous,,http://dbpedia.org/property/notableInstruments,,1,0,notableInstruments,
Count the number of movies whose editors were born in UK,born in,editor,http://dbpedia.org/ontology/birthPlace,http://dbpedia.org/property/editing,2,1,birthPlace,editing
In how many places did the Schutzstaffels die,die,places,http://dbpedia.org/ontology/militaryRank,http://dbpedia.org/property/placeOfDeath,1,1,militaryRank,placeOfDeath
What faith do hang chuon naron and Kron Ngoy follow,faith,faith,http://dbpedia.org/ontology/religion,http://dbpedia.org/ontology/religion,1,1,religion,religion
How many game series exist for iOS,exist,series,http://dbpedia.org/ontology/computingPlatform,http://dbpedia.org/ontology/series,1,1,computingPlatform,series
Which TV show's producer is Stephen E. Ambrose and company is DreamWorks Television,producer,company,http://dbpedia.org/ontology/producer,http://dbpedia.org/ontology/company,1,1,producer,company
What is operated by FedExField,operated,,http://dbpedia.org/ontology/operator,,1,0,operator,
How many other race are there of the adult (pornographic) actors whose ethnicity is Cherokee,ethnicity,ethnicity,http://dbpedia.org/ontology/ethnicity,http://dbpedia.org/property/ethnicity,1,1,ethnicity,ethnicity
Who is the producer of the single which was the subsequent work of He's a Liar,subsequent work,producer,http://dbpedia.org/ontology/subsequentWork,http://dbpedia.org/ontology/producer,2,1,subsequentWork,producer
"What series is Mazes of Time from, and is produced by BBC multimedia",produced,series,http://dbpedia.org/ontology/product,http://dbpedia.org/ontology/series,1,1,product,series
WHo gave the lyrcis of Doonesbury,,,http://dbpedia.org/ontology/lyrics,,0,0,lyrics,
Who are the parents of  Charles Phelps Taft II and Robert A. Taft,parents,parents,http://dbpedia.org/ontology/child,http://dbpedia.org/ontology/child,1,1,child,child
Giorgos Kaminis is the mayor of what,mayor,,http://dbpedia.org/ontology/mayor,,1,0,mayor,
Name the incumbent of Linda Jenness,incumbent,,http://dbpedia.org/ontology/incumbent,,1,0,incumbent,
Which assembly of the Plymouth Savoy is the route end of the NorthSouth Transport Corridor,assembly,route end,http://dbpedia.org/ontology/assembly,http://dbpedia.org/ontology/routeEnd,1,2,assembly,routeEnd
Give me a count of mammals which have their order as Primate,order,,http://dbpedia.org/ontology/order,,1,0,order,
What are the things whose leader was a monarch of Willem-Alexander of the Netherlands,monarch,leader,http://dbpedia.org/ontology/monarch,http://dbpedia.org/ontology/leader,1,1,monarch,leader
Who owns Chelsea F.C.,owns,,http://dbpedia.org/ontology/occupation,,1,0,occupation,
During the reigns of which monarchs was the name to the  Israelite kingdom as United Monarch,Monarch,,http://dbpedia.org/property/title,,1,0,title,
Tell me the total number of organizations who maintain the bridges made by the malaysian PWD,PWD,maintain,http://dbpedia.org/property/designer,http://dbpedia.org/ontology/maintainedBy,1,1,designer,maintainedBy
"Name the river whose mouth place is Old Lyme, Connecticut",mouth place,,http://dbpedia.org/ontology/mouthPlace,,2,0,mouthPlace,
list the  software which works on both the OS  - Microsoft Windows and Mac OS,OS,OS,http://dbpedia.org/ontology/operatingSystem,http://dbpedia.org/ontology/operatingSystem,1,1,operatingSystem,operatingSystem
Which  person has opponent Ike Clanton,opponent,,http://dbpedia.org/ontology/opponent,,1,0,opponent,
"List the affiliation of Indian general election, 2004 (Andhra Pradesh)",affiliation,,http://dbpedia.org/ontology/affiliation,,1,0,affiliation,
Which idelogy of the Palang Dharma Party is also the  faith of Miao people,,faith,http://dbpedia.org/ontology/ideology,http://dbpedia.org/ontology/religion,0,1,ideology,religion
Where did the members of judge advocate general corps study,study,study,http://dbpedia.org/ontology/militaryRank,http://dbpedia.org/ontology/almaMater,1,1,militaryRank,almaMater
In how many different places are Brown haired models living,haired,living,http://dbpedia.org/property/hairColor,http://dbpedia.org/ontology/residence,1,1,hairColor,residence
Solon Spencer Beman has architected in how many cities,architect,cities,http://dbpedia.org/ontology/architect,http://dbpedia.org/property/locationTown,1,1,architect,locationTown
In how many places have the companies started in Newcastle worked,places,worked,http://dbpedia.org/ontology/foundationPlace,http://dbpedia.org/ontology/regionServed,1,1,foundationPlace,regionServed
How many things are produced by companies located in Tehran,located,located,http://dbpedia.org/property/location,http://dbpedia.org/ontology/product,1,1,location,product
Which band had members who are now in The Bleeding Heart Band,band,members,http://dbpedia.org/ontology/associatedBand,http://dbpedia.org/ontology/formerBandMember,1,1,associatedBand,formerBandMember
Rivers which end in Arkansas go through which cities,cities,in,http://dbpedia.org/ontology/mouthMountain,http://dbpedia.org/ontology/city,1,1,mouthMountain,city
Name the party of Indira Gandhi,party,,http://dbpedia.org/ontology/party,,1,0,party,
What are the regions in which the distributor of Secrets and Lies serves,distributor,regions,http://dbpedia.org/ontology/distributor,http://dbpedia.org/ontology/regionServed,1,1,distributor,regionServed
Who owns the websites for which Jimmy wales writes,writes,owns,http://dbpedia.org/ontology/author,http://dbpedia.org/ontology/owner,1,1,author,owner
How many other school are there of the rugby players whose school is Michaelhouse,school,school,http://dbpedia.org/ontology/school,http://dbpedia.org/property/school,1,1,school,school
How many people have been the first one to scale a peak in the Yosemite Park,in,first,http://dbpedia.org/ontology/locatedInArea,http://dbpedia.org/ontology/firstAscentPerson,1,1,locatedInArea,firstAscentPerson
How many buildings are located in Toronto,located,,http://dbpedia.org/property/location,,1,0,location,
Name the military conflict whose commander was Colin Powell and took place in israel,commander,place,http://dbpedia.org/ontology/commander,http://dbpedia.org/ontology/place,1,1,commander,place
Which company was the designer of South African class 11e and RENFE class 333,designer,designer,http://dbpedia.org/ontology/designer,http://dbpedia.org/ontology/designer,1,1,designer,designer
What is the scientist whose doctoral students are Erich Bagge and erban ieica,doctoral student,doctoral student,http://dbpedia.org/ontology/doctoralStudent,http://dbpedia.org/ontology/doctoralStudent,2,2,doctoralStudent,doctoralStudent
How many have family as Ape and order (taxonomy) is Primate,family,order (taxonomy),http://dbpedia.org/ontology/family,http://dbpedia.org/ontology/order,1,2,family,order
Count the total awards won by the writer who has won Goethe Prize,awards,awards,http://dbpedia.org/property/awards,http://dbpedia.org/property/awards,1,1,awards,awards
Games on amiga are typically of what kind,games,kind,http://dbpedia.org/ontology/computingPlatform,http://dbpedia.org/property/genre,1,1,computingPlatform,genre
Muhammad Yunus has won how many awards,awards,,http://dbpedia.org/ontology/award,,1,0,award,
What are some languages in the italic family of languages,family,,http://dbpedia.org/ontology/languageFamily,,1,0,languageFamily,
How many people hold important positions alongwith Donna Shalala,important positions,people,http://dbpedia.org/ontology/keyPerson,http://dbpedia.org/property/keyPeople,2,1,keyPerson,keyPeople
Which currency can I use both in Kerguelen islands and French southern and antarctic lands,currency,currency,http://dbpedia.org/ontology/currency,http://dbpedia.org/ontology/currency,1,1,currency,currency
Who is the father of Edith Vonnegut and is also a writer,father,,http://dbpedia.org/ontology/child,,1,0,child,
List all the movies whose music has been made up with someone under RCA records,records,music,http://dbpedia.org/ontology/recordLabel,http://dbpedia.org/property/music,1,1,recordLabel,music
Is Brazilian jiu-jitsu the trainer of Nick Diaz,trainer,,http://dbpedia.org/ontology/trainer,,1,0,trainer,
What is the total number of other combatant of the military conflicts whose combatant is Choctaw,combatant,combatant,http://dbpedia.org/property/combatant,http://dbpedia.org/property/combatant,1,1,combatant,combatant
What movies have been produced by the production house owned by Larry J. Franco,produced,,http://dbpedia.org/ontology/producer,,1,0,producer,
Count all those who previously played for a team which ownes Varsity Stadium,ownes,team for,http://dbpedia.org/property/field,http://dbpedia.org/ontology/formerTeam,1,2,field,formerTeam
Is NY Rangers a prospective team for Robin Kovacs,team,,http://dbpedia.org/ontology/prospectTeam,,1,0,prospectTeam,
Which home town of PAvel Moroz is the death location of the Yakov Estrin,home town,death location,http://dbpedia.org/property/hometown,http://dbpedia.org/ontology/deathPlace,2,2,hometown,deathPlace
Which person designed the cars which has been designed by ASC Creative Services,designed by,designed,http://dbpedia.org/ontology/designCompany,http://dbpedia.org/property/designer,2,1,designCompany,designer
"What is the hometown of Nader Guirat, where Josef Johansson was born too",born,hometown,http://dbpedia.org/property/birthPlace,http://dbpedia.org/ontology/hometown,1,1,birthPlace,hometown
What is the common genere of Abhijit Kunte and Kasparov,@@@,genere,http://dbpedia.org/property/knownFor,http://dbpedia.org/ontology/genre,1,1,knownFor,genre
What are the type of Greenup County High School,type,,http://dbpedia.org/property/type,,1,0,type,
Which labels signs up progressive rock bands,signs,labels,http://dbpedia.org/property/genre,http://dbpedia.org/ontology/recordLabel,1,1,genre,recordLabel
Which magazine's editor is married to Crystal Harris,married,editor,http://dbpedia.org/property/spouse,http://dbpedia.org/property/editor,1,1,spouse,editor
Which shareholder of Dagenham wind turbines is also the parent company of the Ford Falcon Cobra,company parent,shareholder,http://dbpedia.org/ontology/parentCompany,http://dbpedia.org/property/owner,2,1,parentCompany,owner
Which planet was discovered by Johann Gottfried and Urbain Le Verrier,discovered by,,http://dbpedia.org/property/discoverer,,2,0,discoverer,
where did the office holder died  who is successor to Elmer Burkett,successor,died,http://dbpedia.org/property/successor,http://dbpedia.org/property/deathPlace,1,1,successor,deathPlace
Name the island with archipelago as Society Islands and has the largest city named Faaa,largest city,archipelago,http://dbpedia.org/ontology/largestCity,http://dbpedia.org/property/archipelago,2,1,largestCity,archipelago
Who started at the pole position in both 1997 canadian grand prix and the 94 spanish one,pole position,,http://dbpedia.org/property/poleDriver,,2,0,poleDriver,
Who appointed the governor under whom Richard Winn served,governor,appointed,http://dbpedia.org/ontology/governor,http://dbpedia.org/property/appointer,1,1,governor,appointer
Which tenants of the Master Card center is also th draft team of Sam Carrick,tenants,draft team,http://dbpedia.org/property/tenants,http://dbpedia.org/property/draftTeam,1,2,tenants,draftTeam
Who produced the TV shows for Fremantle Media,Who,produced,http://dbpedia.org/property/company,http://dbpedia.org/ontology/producer,1,1,company,producer
What is the nationality of Newin Chidchob,nationality,,http://dbpedia.org/property/nationality,,1,0,nationality,
Who appointed the governor under which Robert Witherspoon worked,governor,appointed,http://dbpedia.org/ontology/governor,http://dbpedia.org/property/appointer,1,1,governor,appointer
"List the base currency of the country whose anthem is Oj, svijetla majska zoro.",anthem,currency,http://dbpedia.org/ontology/anthem,http://dbpedia.org/property/currency,1,1,anthem,currency
list  the producer of the movies in which Rosemarie DeWitt in the star cast,star,producer,http://dbpedia.org/property/starring,http://dbpedia.org/property/producer,1,1,starring,producer
What is the city whose mayor is Giorgos Kaminis,mayor,,http://dbpedia.org/property/mayor,,1,0,mayor,
What woman acted in the mating habits of earthbound humans and is often associated with Mams taylor,acted,associated,http://dbpedia.org/property/starring,http://dbpedia.org/ontology/associatedMusicalArtist,1,1,starring,associatedMusicalArtist
Which royal person married the successor of Darius I,successor,married,http://dbpedia.org/property/predecessor,http://dbpedia.org/property/spouse,1,1,predecessor,spouse
What is the district of Fort Heath radar station,district,,http://dbpedia.org/property/district,,1,0,district,
Name some shows whose company is owned by the CBS Corporation,owned,company,http://dbpedia.org/ontology/owner,http://dbpedia.org/property/company,1,1,owner,company
Who holds stock in the railway lines ending in Washington DC,ending,holds stock,http://dbpedia.org/ontology/routeEnd,http://dbpedia.org/property/owner,1,2,routeEnd,owner
Where was the narrator of Spain on the Road Again born,narrator,born,http://dbpedia.org/ontology/narrator,http://dbpedia.org/property/birthPlace,1,1,narrator,birthPlace
Name the TV show whose composer is Judy Hart Angelo and company as Paramount Television,composer,company,http://dbpedia.org/ontology/composer,http://dbpedia.org/property/company,1,1,composer,company
Where does the successor of Thongsuk Samdaengpan reside,successor,Where,http://dbpedia.org/property/successor,http://dbpedia.org/ontology/location,1,1,successor,location
Name the sports played by PATTS College of Aeronautics,sports,,http://dbpedia.org/property/athletics,,1,0,athletics,
In which teams have league members of the Czech Extraliga played previously,league,teams,http://dbpedia.org/property/league,http://dbpedia.org/ontology/formerTeam,1,1,league,formerTeam
Who is the office holder with deputies as Neil Brown and Andrew Peacock,deputies,deputies,http://dbpedia.org/property/deputy,http://dbpedia.org/property/deputy,1,1,deputy,deputy
Which executive producer of Into the Dalek also produced Wizards vs Aliens,executive producer,producer,http://dbpedia.org/property/executiveProducer,http://dbpedia.org/ontology/producer,2,1,executiveProducer,producer
Who appointed the successor of Charles Pinckney,successor,appointed,http://dbpedia.org/ontology/successor,http://dbpedia.org/property/appointer,1,1,successor,appointer
What is the name of the movie whose director of photography was Jordan Cronenweth and music composer was Vangelis,photography,music composer,http://dbpedia.org/property/cinematography,http://dbpedia.org/ontology/musicComposer,1,2,cinematography,musicComposer
Where did Goran Cengic die,die,,http://dbpedia.org/property/deathPlace,,1,0,deathPlace,
Who all have rented the stadium whose architect is Populous,architect,rented,http://dbpedia.org/property/architect,http://dbpedia.org/ontology/tenant,1,1,architect,tenant
Which body governs over the place made by the chumash people,made by,governs,http://dbpedia.org/property/architect,http://dbpedia.org/ontology/governingBody,2,1,architect,governingBody
Which hometown of pavel Moroz is also the palace of birthplace of Helena of Moscow,hometown,birthplace,http://dbpedia.org/property/hometown,http://dbpedia.org/ontology/birthPlace,1,1,hometown,birthPlace
Which Fox  show is presented by Ryan Seacrest,presented,show,http://dbpedia.org/ontology/presenter,http://dbpedia.org/property/channel,1,1,presenter,channel
What is the alma mater of the actors of The God Who Wasn't There,actor,alma mater,http://dbpedia.org/property/starring,http://dbpedia.org/property/almaMater,1,2,starring,almaMater
What sporting goods companies are located in Herzogenaurach,located,,http://dbpedia.org/property/location,,1,0,location,
What genre of games are made by Blizzard Entertainment studios,made,genre,http://dbpedia.org/ontology/developer,http://dbpedia.org/property/genre,1,1,developer,genre
Which predecessor of Alexander Downer was deputy to Neil Brown,predecessor,deputy,http://dbpedia.org/ontology/predecessor,http://dbpedia.org/property/deputy,1,1,predecessor,deputy
Which sports are played in the alma mater of Amitava Datta,alma mater,sport,http://dbpedia.org/property/almaMater,http://dbpedia.org/ontology/sport,2,1,almaMater,sport
Under which archipelago does Canary Islands fall,archipelago,,http://dbpedia.org/property/archipelago,,1,0,archipelago,
What is the craft of the Ralph Flanders which is also the profession of  Claiborne Pell,profession,profession,http://dbpedia.org/property/occupation,http://dbpedia.org/ontology/profession,1,1,occupation,profession
Where do the CNN employees typically graduate from,employees,graduate,http://dbpedia.org/property/employer,http://dbpedia.org/ontology/almaMater,1,1,employer,almaMater
What is the affiliation of tani University,affiliation,,http://dbpedia.org/property/affiliation,,1,0,affiliation,
Who was the architect of the stadium currently run by the Pittsburgh Pirates,run by,architect,http://dbpedia.org/property/operator,http://dbpedia.org/property/architect,2,1,operator,architect
What race of Linda Hogan is the state of origin of the Holmes Colbert,race,state of origin,http://dbpedia.org/property/ethnicity,http://dbpedia.org/ontology/stateOfOrigin,1,3,ethnicity,stateOfOrigin
What is the name of the artist which worked on the subsequent work of Ella Loves Cole,subsequent work,artist,http://dbpedia.org/ontology/subsequentWork,http://dbpedia.org/property/artist,2,1,subsequentWork,artist
What are the television shows whose network is Prime Time Entertainment Network,network,,http://dbpedia.org/property/network,,1,0,network,
What is the place of birth of the stars of Auto Shankar,stars,place birth,http://dbpedia.org/property/starring,http://dbpedia.org/ontology/birthPlace,1,2,starring,birthPlace
Who is the writer of the singles whose producer is Peter-John Vettese,producer,writer,http://dbpedia.org/property/producer,http://dbpedia.org/ontology/writer,1,1,producer,writer
What is the common race of the Martin Molony and race of the Coneygree,race,race,http://dbpedia.org/ontology/race,http://dbpedia.org/property/race,1,1,race,race
Name the movies distributed by RKO Pictures and has music composer as Bernard Herrmann,distributed by,music composer,http://dbpedia.org/property/distributor,http://dbpedia.org/ontology/musicComposer,2,2,distributor,musicComposer
Give me some series related to the one which had Yasmin Paige in them.,in,related,http://dbpedia.org/property/starring,http://dbpedia.org/ontology/related,1,1,starring,related
Who is the artist of Sings Kristofferson and also performed Milk Cow Blues atleast once,artist,artist,http://dbpedia.org/property/artist,http://dbpedia.org/ontology/artist,1,1,artist,artist
What is the television show whose producer is Stephen E. Ambrose,producer,,http://dbpedia.org/property/producer,,1,0,producer,
Which TV show's  opening theme is The Best of Both Worlds (song) and executive producer is Steven Peterman,opening theme,executive producer,http://dbpedia.org/ontology/openingTheme,http://dbpedia.org/property/executiveProducer,2,2,openingTheme,executiveProducer
What is the religion of the person who is in the cast of Master's Sun>,in,religion,http://dbpedia.org/ontology/starring,http://dbpedia.org/property/religion,1,1,starring,religion
List the people who were born in Gelnhausen and graduated from Pepperdine University,born in,graduated from,http://dbpedia.org/ontology/birthPlace,http://dbpedia.org/property/education,2,2,birthPlace,education
Which TV shows distributor is Broadcast syndication and developed by Brian Graden,developed by,distributor,http://dbpedia.org/property/developer,http://dbpedia.org/ontology/distributor,2,1,developer,distributor
Which university was attended by both Richard H Immerman and Franklin W Olin,attended,attended,http://dbpedia.org/property/education,http://dbpedia.org/property/education,1,1,education,education
Name someone known for a project involved in the Occupation of Japan,project,known for,http://dbpedia.org/ontology/battle,http://dbpedia.org/property/knownFor,1,2,battle,knownFor
What is the awards given to the horse whose grandson is the famous Counterpoint,grandson,awards,http://dbpedia.org/property/grandsire,http://dbpedia.org/ontology/honours,1,1,grandsire,honours
what kind of games can I find for PC 9800,PC,kind,http://dbpedia.org/ontology/computingPlatform,http://dbpedia.org/property/genre,1,1,computingPlatform,genre
List the director of The Adventures of mimi,director,,http://dbpedia.org/property/director,,1,0,director,
Name the movie whose director is Ridley Scott and it's music composer is Vangelis,director,music composer,http://dbpedia.org/property/director,http://dbpedia.org/ontology/musicComposer,1,2,director,musicComposer
List the home stadiums of the teams in the Russian Premier League,League,home stadium,http://dbpedia.org/property/league,http://dbpedia.org/ontology/homeStadium,1,2,league,homeStadium
In which country is there a dam on the Awash river,river,country,http://dbpedia.org/ontology/river,http://dbpedia.org/property/country,1,1,river,country
Which astronauts went on the Gemini 8 mission,mission,,http://dbpedia.org/property/mission,,1,0,mission,
